{
  "$schema": "http://json-schema.org/draft-07/schema#",
  "title": "CMS CLI Configuration Schema",
  "type": "object",
  "properties": {
    "content_dir": {
      "type": "string",
      "description": "The directory path where your Markdown files (.md) are stored.",
      "default": "./content"
    },
    "output_dir": {
      "type": "string",
      "description": "The directory path where all build outputs are exported: all.json (full post data including content), category.json (category -> {image, slugs}), and tag.json (tag -> {image, slugs}).",
      "default": "./dist"
    },
    "categories": {
      "type": "array",
      "description": "A whitelist of allowed categories, each with an optional image path. Unregistered categories found in markdown will be skipped. Image files themselves are not managed by this tool; only the path string is carried through to the output.",
      "items": {
        "$ref": "#/$defs/taxonomyDefinition"
      },
      "uniqueItems": true
    },
    "tags": {
      "type": "array",
      "description": "A whitelist of allowed tags, each with an optional image path. Unregistered tags found in markdown will be skipped. Image files themselves are not managed by this tool; only the path string is carried through to the output.",
      "items": {
        "$ref": "#/$defs/taxonomyDefinition"
      },
      "uniqueItems": true
    }
  },
  "required": ["content_dir", "output_dir", "categories", "tags"],
  "additionalProperties": false,
  "$defs": {
    "taxonomyDefinition": {
      "type": "object",
      "properties": {
        "name": {
          "type": "string",
          "description": "The category or tag name, matched against the front matter of each post."
        },
        "image": {
          "type": "string",
          "description": "An optional path or URL to an image representing this category or tag (e.g. for use as a thumbnail or banner). This tool does not read, copy, or validate the image file itself."
        }
      },
      "required": ["name"],
      "additionalProperties": false
    }
  }
}
